{
  "id": "regimen.health",
  "type": "Regimen",
  "name": "Health Regimen",
  "routine_ids": ["routine.health_daily"],
  "purpose": "Protect the physical base that funds sustained agency and mission execution.",
  "supports_affair_ids": ["affair.health"],
  "supports_mission_ids": ["mission.build_ai_business"],
  "status": "active"
}
